var; spanish; english; french;id
title;La Casa Azul;La Casa Azul;La Casa Azul;
subtitle; Ideal para la familia; Ideal for the family;Découvrez Lanzarote;
description; Lorem Ipsum is simply dummy text of the printing and typesetting industry. Lorem Ipsum has been the industry's standard dummy text ever since the 1500s, when an unknown printer took a galley of type and scrambled it to make a type specimen book; Lorem Ipsum is simply dummy text of the printing and typesetting industry. Lorem Ipsum has been the industry's standard dummy text ever since the 1500s, when an unknown printer took a galley of type and scrambled it to make a type specimen book;Profitez de vos vacances loin du tourisme de masse à Punta Mujeres, un pittoresque village de pêcheurs situé au nord-est de l’île. C’est là que vous rencontrerez  la Casa Azul, une maison singulière <span class="w3-tag w3-light-grey"> au bord de mer </span> ou le silence n’est troublé que par le ressac.;
subdescription; Lorem Ipsum is simply dummy text of the printing and typesetting industry. Lorem Ipsum has been the industry's standard dummy text ever since the 1500s, when an unknown printer took a galley of type and scrambled it to make a type specimen book; Lorem Ipsum is simply dummy text of the printing and typesetting industry. Lorem Ipsum has been the industry's standard dummy text ever since the 1500s, when an unknown printer took a galley of type and scrambled it to make a type specimen book;Construit devant la promenade maritime, vous y trouverez 4 appartements disposant de toutes les commodités nécessaires pour passer de magnifiques vacances.;
imgs;Vista Aérea,Exterior, Frente, Piscina Natural; Aerial View, Outside, Facade, Natural swimming pool; Vue Aérienne, Extérieur, Façade, Piscine naturelle; aerial_view.jpg, exterior.jpg, frente.jpg, piscina_natural.jpg;
