var; spanish; english;french;id
title; La Cueva; La Cueva;La Cueva;
subtitle; Ideal para la familia; Ideal for the family;Idéal pour un couple;
description; Lorem Ipsum is simply dummy text of the printing and typesetting industry. Lorem Ipsum has been the industry's standard dummy text ever since the 1500s, when an unknown printer took a galley of type and scrambled it to make a type specimen book; Lorem Ipsum is simply dummy text of the printing and typesetting industry. Lorem Ipsum has been the industry's standard dummy text ever since the 1500s, when an unknown printer took a galley of type and scrambled it to make a type specimen book;Situé au rez de chaussée, c'est un très grand appartement de <span class="w3-tag w3-light-grey">41m²</span> constitué d'une chambre, un salon-cuisine et une salle de bain avec baignoire. Chambre à coucher spacieuse avec 1 lit double.;
subdescription; Lorem Ipsum is simply dummy text of the printing and typesetting industry. Lorem Ipsum has been the industry's standard dummy text ever since the 1500s, when an unknown printer took a galley of type and scrambled it to make a type specimen book; Lorem Ipsum is simply dummy text of the printing and typesetting industry. Lorem Ipsum has been the industry's standard dummy text ever since the 1500s, when an unknown printer took a galley of type and scrambled it to make a type specimen book;L'accès se fait soit par l'entrée principale soit par la promenade maritime.;
imgs;La Cueva, Salón,Salón, Cocina, Habitación, Habitación, Baño;La Cueva, Living room,Living room, Kitchen, Bedroom,Bedroom, Toilet; La Cueva, Salon, Salon, Cuisine, Chambre, Chambre, Toilettes;logo_cuevas.png, salon.jpg,salon2.jpg, cuisine.jpg, chambre.jpg,chambre2.jpg, bathroom.jpg
price;;;;50-65;
